<root xmlns:xsi='http://www.w3.org/2001/XMLSchema-instance' 
      xsi:noNamespaceSchemaLocation='test.xsd'>
 <bar>text1</bar>
 <baz>text2</baz>
 <foo/>
 <bar>text3</bar>
 <baz>text4</baz>
 <bar>text5</bar>
 <baz><mumble>text5<foo/></mumble></baz>
</root>